编号,名称,作用描述,初始,需求,留空列
0,冰冻宝石,"降低敌方单位${decMovePercent=(80)}%总移动速度、${decAttackSpeedPercent=(50)}%总攻击速度、${decAttackPercent=(50)}%总攻击力，每秒目标增加${iceValue0=(15)}点<冰冻损伤>，这些效果一共持续${t=(10)}秒。
此外，触发时还会释放一道冰锥攻击，对接触的目标施加${iceValue1=(80)}点<冰冻损伤>；冰冻宝石生效期间新生成的老鼠也会立即被施加${iceValue1}点<冰冻损伤>；",0,60,
1,神圣宝石,使当前全场友方单位获得${defence=(100)}%减伤，每秒回复${healPercent=(20)}%最大生命值，持续${t=(5)}秒。,0,90,
2,轰炸宝石,定点投放五个炸弹，每个炸弹都会对4*3范围内的敌人造成一次灰烬效果。,0,120,
3,激光宝石,立即闪瞎全场敌方单位，使它们受到持续${t=(5)}秒的晕眩效果；然后每行发射一道激光，对激光穿过的敌方单位造成一次灰烬效果。,60,180,
4,猫眼宝石,每行召唤一只猫猫，猫猫能秒杀接触的非BOSS敌方单位。,210,360,
5,强力宝石,使当前全场友方单位攻击力提高相当于它们的${attackPercent=(40)}%基础攻击力，持续${t=(10)}秒。,0,90,
6,疾风宝石,使当前全场友方单位攻击速度提高相当于它们的${attackSpeedPercent=(25)}%基础攻击速度和免疫定身效果，持续${t=(30)}秒。,0,120,
